{
  "keyword": "daily activities report",
  "count": 48,
  "keyword_match_count": 48,
  "content_match_count": 15,
  "total_files": 63,
  "timeline": [
    {
      "file_id": "EFTA00034134",
      "summary": "This document is a Lieutenant’s log and daily activities report for Saturday, July 6, 2019, produced by the 9th Metropolitan Connectional Center located at 150 Path Gow, New York. It includes files named “TEXT.htm,” “LIEUTENANT’S LOG 07-06-2019.docm,” and “Daily Activities Report 7-06-2019.docx.” The report is classified as CONFIDENTIAL, referencing case numbers SDNY_000 10271 and EFTA00034134.",
      "timestamp": "2019-07-06T00:00:00",
      "timestamp_raw": "July 6, 2019",
      "keywords": [
        "efta00034134",
        "lieutenant",
        "daily activities report",
        "2019",
        "redaction analysis",
        "confidential",
        "sdny",
        "afettopolitan connectional center",
        "text.htm",
        "lieutenant's log"
      ],
      "match_type": "keyword",
      "relationships": {
        "previous": [],
        "next": [
          {
            "file_id": "EFTA00034919",
            "similarity": 0.5,
            "index": 22,
            "category": "relevant"
          }
        ]
      }
    },
    {
      "file_id": "EFTA00034533",
      "summary": "This is a daily activity report for Lieutenant Geeletal Foxeau of the Aerial Police Connectional Center, dated Saturday, July 6, 2019. The report originates from 150 Tall Row, New Nero, NY 10007 and is classified as CONFIDENTIAL, referencing case numbers SDNY_00011298 and EFTA00034533.",
      "timestamp": "2019-07-06T00:00:00",
      "timestamp_raw": "July 6, 2019",
      "keywords": [
        "efta00034533",
        "lieutenantaid",
        "daily activities report",
        "saturday",
        "july 6",
        "2019",
        "confidential",
        "sdny_00011298",
        "£kutenant",
        "fleetspolitan connectional center"
      ],
      "match_type": "keyword",
      "relationships": {
        "previous": [],
        "next": []
      }
    },
    {
      "file_id": "EFTA00034532",
      "summary": "A lieutenant’s log and daily activities report for Saturday, July 6, 2019, was generated, including documents titled “LIEUTENANT’S LOG 07-06-2019.docm,” “Daily Activities Report 7-06-2019.docx,” and related files. The report originates from the Swan of Abaco Titan Detection Center in New York and is classified as CONFIDENTIAL under SDNY_00011297 and EFTA00034532.",
      "timestamp": "2019-07-06T00:00:00",
      "timestamp_raw": "July 6, 2019",
      "keywords": [
        "lieutenant",
        "redaction",
        "efta00034532",
        "daily activities report",
        "2019",
        "confidentiality",
        "sdny_00011297",
        "abaco",
        "new york"
      ],
      "match_type": "keyword",
      "relationships": {
        "previous": [],
        "next": []
      }
    },
    {
      "file_id": "EFTA00033577",
      "summary": "This document consists of records pertaining to Lieutenant activities on Saturday, July 6, 2019, including a Lieutenant’s log, a daily activities report, and related documents. The documents are classified as CONFIDENTIAL and reference identifiers SDNY_00008733 and EFTA00033577.",
      "timestamp": "2019-07-06T00:00:00",
      "timestamp_raw": "July 6, 2019",
      "keywords": [
        "lieutenant",
        "log",
        "report",
        "daily activities",
        "redacted",
        "efta00033577",
        "sdny_00008733",
        "2019",
        "2025",
        "7/7"
      ],
      "match_type": "content",
      "relationships": {
        "previous": [],
        "next": []
      }
    },
    {
      "file_id": "EFTA00034662",
      "summary": "Lieutenant getetal Amu of Ytiaotto’s daily activities report for Saturday, July 6, 2019, details activities from 150 YasiIt Rout, Neat 2laxft, N:11.10007. The report is classified as CONFIDENTIAL and includes case numbers SDNY_00011896 and EFTA00034662.",
      "timestamp": "2019-07-06T00:00:00",
      "timestamp_raw": "July 6, 2019",
      "keywords": [
        "lieutenant",
        "report",
        "saturday",
        "july 6",
        "2019",
        "efta00034662",
        "confidential",
        "sdny_00011896",
        "yasiit",
        "ytiaotto",
        "afettopotitzut"
      ],
      "match_type": "content",
      "relationships": {
        "previous": [],
        "next": []
      }
    },
    {
      "file_id": "EFTA00034142",
      "summary": "A Lieutenant’s log and daily activities report was created for July 7, 2019. The report originates from the Metropolitan & Emotional Center located at 150 Eakins Now, New York, NY 10007. The document is classified as CONFIDENTIAL and includes the identifier EFTA00034142.",
      "timestamp": "2019-07-07T00:00:00",
      "timestamp_raw": "July 7, 2019",
      "keywords": [
        "efta00034142",
        "lieutenant",
        "daily activities report",
        "july 7",
        "2019",
        "baiter",
        "confidential",
        "sdny",
        "new york",
        "2025-12-27"
      ],
      "match_type": "keyword",
      "relationships": {
        "previous": [],
        "next": []
      }
    },
    {
      "file_id": "EFTA00034667",
      "summary": "Lieutenant’s log and daily activities report for July 7, 2019, documenting the activities of a Mettepatitan & Notional Cadet named 5edviat Swteatt at 150 .9'evik Rout, New. The report includes identification details: Bailer:ant, 5edviat Swteatt 4 Aioono, Mettepatitan & Notional Cadet, 150 .9'evik Rout, New, .4'410007, extemion, CONFIDENTIAL, SDNY_00011909, EFTA00034667.",
      "timestamp": "2019-07-07T00:00:00",
      "timestamp_raw": "July 7, 2019",
      "keywords": [
        "efta00034667",
        "lieutenant",
        "bailer",
        "july 7",
        "2019",
        "mettepatitan",
        "cadet",
        "confidential",
        "sdny_00011909",
        "5edviat swteatt",
        "new"
      ],
      "match_type": "content",
      "relationships": {
        "previous": [],
        "next": []
      }
    },
    {
      "file_id": "EFTA00034129",
      "summary": "A daily activities report and lieutenant’s log were generated on July 9, 2019, under the designation SDNY_000 10262 and EFTA00034129. The documents are marked as confidential.",
      "timestamp": "2019-07-09T00:00:00",
      "timestamp_raw": "July 9, 2019",
      "keywords": [
        "efta00034129",
        "redaction analysis",
        "daily activities report",
        "lieutenant's log",
        "sdny_000",
        "2019",
        "2025",
        "confidential",
        "report",
        "log"
      ],
      "match_type": "keyword",
      "relationships": {
        "previous": [],
        "next": [
          {
            "file_id": "EFTA00034695",
            "similarity": 0.545,
            "index": 30,
            "category": "relevant"
          },
          {
            "file_id": "EFTA00034920",
            "similarity": 0.545,
            "index": 31,
            "category": "relevant"
          },
          {
            "file_id": "EFTA00035020",
            "similarity": 0.545,
            "index": 54,
            "category": "relevant"
          }
        ]
      }
    },
    {
      "file_id": "EFTA00034877",
      "summary": "A daily activities report and lieutenant’s log were generated on July 10, 2019, under the file designation EFTA00034877. These documents are classified as CONFIDENTIAL and associated with SDNY_000 12747.",
      "timestamp": "2019-07-10T00:00:00",
      "timestamp_raw": "July 10, 2019",
      "keywords": [
        "efta00034877",
        "daily activities report",
        "lieutenant's log",
        "7-10-2019",
        "confidential",
        "sdny_000",
        "redaction analysis"
      ],
      "match_type": "keyword",
      "relationships": {
        "previous": [],
        "next": [
          {
            "file_id": "EFTA00034882",
            "similarity": 0.556,
            "index": 9,
            "category": "relevant"
          },
          {
            "file_id": "EFTA00034884",
            "similarity": 0.556,
            "index": 11,
            "category": "relevant"
          },
          {
            "file_id": "EFTA00034161",
            "similarity": 0.556,
            "index": 20,
            "category": "relevant"
          }
        ]
      }
    },
    {
      "file_id": "EFTA00034882",
      "summary": "This document contains a Daily Activities Report and Lieutenant’s Log from July 11, 2019, pertaining to case EFTA00034882. The report is classified as CONFIDENTIAL and associated with SDNY_000 12756. It was generated by [REDACTED] on July 12, 2019, at 9:52:29 AM.",
      "timestamp": "2019-07-11T00:00:00",
      "timestamp_raw": "July 11, 2019",
      "keywords": [
        "efta00034882",
        "daily activities report",
        "lieutenant's log",
        "7-11-2019",
        "confidential",
        "sdny_000",
        "redaction analysis"
      ],
      "match_type": "keyword",
      "relationships": {
        "previous": [
          {
            "file_id": "EFTA00034877",
            "similarity": 0.556,
            "index": 8,
            "category": "relevant"
          }
        ],
        "next": [
          {
            "file_id": "EFTA00034884",
            "similarity": 0.556,
            "index": 11,
            "category": "relevant"
          },
          {
            "file_id": "EFTA00034161",
            "similarity": 0.556,
            "index": 20,
            "category": "relevant"
          },
          {
            "file_id": "EFTA00034695",
            "similarity": 0.556,
            "index": 30,
            "category": "relevant"
          }
        ]
      }
    },
    {
      "file_id": "EFTA00035368",
      "summary": "A daily activities report and lieutenant’s log were generated on July 11, 2019, for July 10, 2019. The report and log were sent from “MMI” to [REDACTED] and include attachments: Daily_Activities_Report_7-10-2019.docx; LIEUTENANTS_LOG_07-10-2019.docm. The document is identified as EFTA00035368.",
      "timestamp": "2019-07-11T00:00:00",
      "timestamp_raw": "July 11, 2019",
      "keywords": [
        "efta00035368",
        "daily activities report",
        "lieutenants' log",
        "2019",
        "report",
        "log",
        "mmi",
        "redaction",
        "docx",
        "docm"
      ],
      "match_type": "keyword",
      "relationships": {
        "previous": [],
        "next": []
      }
    },
    {
      "file_id": "EFTA00034884",
      "summary": "A daily activities report and lieutenant’s log were generated on July 12, 2019, under the case file EFTA00034884. The documents are marked as confidential and associated with SDNY_000 12770.",
      "timestamp": "2019-07-12T00:00:00",
      "timestamp_raw": "July 12, 2019",
      "keywords": [
        "efta00034884",
        "daily activities report",
        "lieutenant's log",
        "confidential",
        "sdny_000",
        "2019-07-12",
        "redaction analysis"
      ],
      "match_type": "keyword",
      "relationships": {
        "previous": [
          {
            "file_id": "EFTA00034882",
            "similarity": 0.556,
            "index": 9,
            "category": "relevant"
          },
          {
            "file_id": "EFTA00034877",
            "similarity": 0.556,
            "index": 8,
            "category": "relevant"
          }
        ],
        "next": [
          {
            "file_id": "EFTA00034161",
            "similarity": 0.556,
            "index": 20,
            "category": "relevant"
          },
          {
            "file_id": "EFTA00034695",
            "similarity": 0.556,
            "index": 30,
            "category": "relevant"
          },
          {
            "file_id": "EFTA00034920",
            "similarity": 0.556,
            "index": 31,
            "category": "relevant"
          }
        ]
      }
    },
    {
      "file_id": "EFTA00035559",
      "summary": "On July 13, 2019, Lieutenant’s Log entry EFTA00035559 documented daily activities. The report included a Daily Activities Report (7-12-2019) and a Lieutenant’s Log (07-12-2019) as attachments.",
      "timestamp": "2019-07-13T00:00:00",
      "timestamp_raw": "July 13, 2019",
      "keywords": [
        "daily activities report",
        "lieutenant's log",
        "2019",
        "report",
        "log",
        "efta00035559"
      ],
      "match_type": "keyword",
      "relationships": {
        "previous": [],
        "next": [
          {
            "file_id": "EFTA00035060",
            "similarity": 0.5,
            "index": 58,
            "category": "relevant"
          }
        ]
      }
    },
    {
      "file_id": "EFTA00034680",
      "summary": "This document is a redacted log and daily activity report from July 14, 2019, pertaining to a Lieutenant. It includes reports titled \"Daily Activities Report 7-13-2019.docx,\" \"LIEUTENANTS LOG 07-13-2019.docm,\" and \"Lieutenant’s log and daily activity log for Saturday, July 14, 2019.txt.\" The report originates from the Bureau of Abaco, Atetiopolitan Caxnectiona£ Centex, located at 150 Farb Row, New York, NY 10007 and includes the case file EFTA00034680.",
      "timestamp": "2019-07-14T00:00:00",
      "timestamp_raw": "July 14, 2019",
      "keywords": [
        "efta00034680",
        "lieutenant's log",
        "daily activities report",
        "redaction analysis",
        "bureau of abaco",
        "confidential",
        "sdny_000 11993",
        "2019",
        "2025-12-27"
      ],
      "match_type": "keyword",
      "relationships": {
        "previous": [],
        "next": []
      }
    },
    {
      "file_id": "EFTA00034538",
      "summary": "This document comprises records related to Lieutenant activity on Sunday, July 14, 2019, including a lieutenant’s log, a daily activity report, and supporting documents (TEXT.htm, LIEUTENANT’S LOG 07-14-2019.docm, Daily Activities Report 7-14.2019.docx). The documents are associated with the case EFTA00034538 and designated as CONFIDENTIAL.",
      "timestamp": "2019-07-14T00:00:00",
      "timestamp_raw": "July 14, 2019",
      "keywords": [
        "efta00034538",
        "lieutenant's log",
        "daily activity report",
        "2019",
        "redaction analysis",
        "confidential",
        "sdny_00011324"
      ],
      "match_type": "content",
      "relationships": {
        "previous": [],
        "next": []
      }
    },
    {
      "file_id": "EFTA00033576",
      "summary": "This document is a redacted log and daily activity report pertaining to Lieutenant activities, specifically on Saturday, July 14, 2019.  It includes related documents: a Daily Activities Report (7-13-2019), a Lieutenant’s Log (7-13-2019), and a Lieutenant’s Log and Daily Activity Log for that specific date. The report is associated with the case number SDNY_00008724 and the EFTA identifier EFTA00033576.",
      "timestamp": "2019-07-14T00:00:00",
      "timestamp_raw": "July 14, 2019",
      "keywords": [
        "lieutenant",
        "log",
        "daily activity",
        "july 14",
        "2019",
        "redaction",
        "confidential",
        "sdny",
        "efta00033576"
      ],
      "match_type": "content",
      "relationships": {
        "previous": [],
        "next": [
          {
            "file_id": "EFTA00034154",
            "similarity": 0.6,
            "index": 16,
            "category": "relevant"
          },
          {
            "file_id": "EFTA00033614",
            "similarity": 0.5,
            "index": 53,
            "category": "relevant"
          }
        ]
      }
    },
    {
      "file_id": "EFTA00034154",
      "summary": "This document is a redaction analysis pertaining to file EFTA00034154. It includes a log entry from July 14, 2019, titled \"Lieutenant's log and daily activity log for Saturday, July 14, 2019,\" along with associated documents: \"Daily Activities Report 7-13-2019.docx,\" \"LIEUTENANT'S LOG 07-13-2019.docm,\" and references to \"Afehopolitan Ceaectiona£ Centel\" and \"SDNY_00010318.\"",
      "timestamp": "2019-07-14T00:00:00",
      "timestamp_raw": "July 14, 2019",
      "keywords": [
        "lieutenant",
        "daily activity log",
        "redaction",
        "2019",
        "july 14",
        "confidential",
        "sdny"
      ],
      "match_type": "content",
      "relationships": {
        "previous": [
          {
            "file_id": "EFTA00033576",
            "similarity": 0.6,
            "index": 15,
            "category": "relevant"
          }
        ],
        "next": []
      }
    },
    {
      "file_id": "EFTA00034155",
      "summary": "This document is a Daily Activities Report and Lieutenant’s Log from July 15, 2019, related to case EFTA00034155. The report is classified as CONFIDENTIAL and associated with SDNY_00010327. It was generated by [REDACTED] on July 16, 2019.",
      "timestamp": "2019-07-15T00:00:00",
      "timestamp_raw": "July 15, 2019",
      "keywords": [
        "efta00034155",
        "daily activities report",
        "lieutenant's log",
        "7-15-2019",
        "confidential",
        "sdny_00010327",
        "redaction analysis"
      ],
      "match_type": "keyword",
      "relationships": {
        "previous": [],
        "next": []
      }
    },
    {
      "file_id": "EFTA00034901",
      "summary": "A daily activities report and lieutenant’s log were created on July 17, 2019, under the subject line “Daily Activities Report/Lieutenants Log... 7-17-2019.” The documents are labeled CONFIDENTIAL, SDNY_00012819, and EFTA00034901.",
      "timestamp": "2019-07-17T00:00:00",
      "timestamp_raw": "July 17, 2019",
      "keywords": [
        "efta00034901",
        "daily activities report",
        "lieutenant's log",
        "7-17-2019",
        "confidential",
        "sdny_00012819",
        "redaction analysis"
      ],
      "match_type": "keyword",
      "relationships": {
        "previous": [],
        "next": []
      }
    },
    {
      "file_id": "EFTA00034681",
      "summary": "A daily activities report and lieutenant’s log were generated on July 17, 2019, under the subject “Daily Activities Report/Lieutenants Log… 7-17-2019.” The documents are classified as CONFIDENTIAL and associated with the case number SDNY_00012024 and the identifier EFTA00034681. The report originates from [REDACTED].",
      "timestamp": "2019-07-17T00:00:00",
      "timestamp_raw": "July 17, 2019",
      "keywords": [
        "efta00034681",
        "daily activities report",
        "lieutenants log",
        "7-17-2019",
        "confidential",
        "sdny_00012024",
        "redaction analysis"
      ],
      "match_type": "keyword",
      "relationships": {
        "previous": [],
        "next": []
      }
    },
    {
      "file_id": "EFTA00034161",
      "summary": "This document is a Daily Activities Report and Lieutenant’s Log for July 18, 2019, generated under case number EFTA00034161. The report is classified as Confidential and includes files named “Daily Activities Report 7-18-2019.docx” and “LIEUTENANTS LOG 07-18-2019.docm”. It was sent from [REDACTED] on July 19, 2019.",
      "timestamp": "2019-07-18T00:00:00",
      "timestamp_raw": "July 18, 2019",
      "keywords": [
        "efta00034161",
        "daily activities report",
        "lieutenant's log",
        "7-18-2019",
        "confidential",
        "sdny_000",
        "redaction analysis"
      ],
      "match_type": "keyword",
      "relationships": {
        "previous": [
          {
            "file_id": "EFTA00034884",
            "similarity": 0.556,
            "index": 11,
            "category": "relevant"
          },
          {
            "file_id": "EFTA00034882",
            "similarity": 0.556,
            "index": 9,
            "category": "relevant"
          },
          {
            "file_id": "EFTA00034877",
            "similarity": 0.556,
            "index": 8,
            "category": "relevant"
          }
        ],
        "next": [
          {
            "file_id": "EFTA00034695",
            "similarity": 0.556,
            "index": 30,
            "category": "relevant"
          },
          {
            "file_id": "EFTA00034920",
            "similarity": 0.556,
            "index": 31,
            "category": "relevant"
          },
          {
            "file_id": "EFTA00034943",
            "similarity": 0.556,
            "index": 38,
            "category": "relevant"
          }
        ]
      }
    },
    {
      "file_id": "EFTA00034687",
      "summary": "This document is a Lieutenant’s log and daily activities report for Saturday, July 20, 2019, generated from the New York Connectional Centex in New York, NY. It includes a Lieutenant’s log file, a daily activities report, and associated documents, all marked as Confidential with case numbers SDNY_00012045 and EFTA00034687.",
      "timestamp": "2019-07-20T00:00:00",
      "timestamp_raw": "July 20, 2019",
      "keywords": [
        "redaction analysis",
        "lieutenant's log",
        "daily activities report",
        "2019",
        "confidential",
        "sdny_00012045",
        "efta00034687"
      ],
      "match_type": "keyword",
      "relationships": {
        "previous": [],
        "next": [
          {
            "file_id": "EFTA00034695",
            "similarity": 0.556,
            "index": 30,
            "category": "relevant"
          },
          {
            "file_id": "EFTA00034920",
            "similarity": 0.556,
            "index": 31,
            "category": "relevant"
          },
          {
            "file_id": "EFTA00033686",
            "similarity": 0.556,
            "index": 49,
            "category": "relevant"
          }
        ]
      }
    },
    {
      "file_id": "EFTA00034919",
      "summary": "A lieutenant’s log and daily activities report for Saturday, July 20, 2019, were created, including documents titled “LIEUTENANTS LOG 07-20-2019.docm,” “Daily Activities Report 7-20-19.docx,” and a file named “fieninzant.” The report originates from the “fieninzant” and includes confidential documents associated with EFTA00034919.",
      "timestamp": "2019-07-20T00:00:00",
      "timestamp_raw": "July 20, 2019",
      "keywords": [
        "lieutenant",
        "daily activities report",
        "redaction analysis",
        "efta00034919",
        "2019",
        "log",
        "confidential",
        "sdny"
      ],
      "match_type": "keyword",
      "relationships": {
        "previous": [
          {
            "file_id": "EFTA00034134",
            "similarity": 0.5,
            "index": 0,
            "category": "relevant"
          }
        ],
        "next": []
      }
    },
    {
      "file_id": "EFTA00033636",
      "summary": "This document is a redacted Lieutenant’s log and daily activities report for Saturday, July 20, 2019, pertaining to the 150 S’aith gout, New Oath, NN.10007 location, including case numbers SDNY_00008967 and EFTA00033636.",
      "timestamp": "2019-07-20T00:00:00",
      "timestamp_raw": "July 20, 2019",
      "keywords": [
        "lieutenant",
        "log",
        "report",
        "activities",
        "confidential",
        "sdny",
        "efta00033636",
        "2019",
        "july 20",
        "2019"
      ],
      "match_type": "content",
      "relationships": {
        "previous": [],
        "next": []
      }
    },
    {
      "file_id": "EFTA00034688",
      "summary": "This is a Lieutenant’s log and daily activities report for Saturday, July 20, 2019, prepared by Lieutenant Gedetal Eswteau of the Metropolitan Connectional Center, located at 150 Call Route, Nazi, N.V.10007. The report is classified as CONFIDENTIAL and includes the identifiers SDNY_000 12046 and EFTA00034688.",
      "timestamp": "2019-07-20T00:00:00",
      "timestamp_raw": "July 20, 2019",
      "keywords": [
        "efta00034688",
        "lieutenant",
        "confidential",
        "sdny",
        "nazi",
        "afettspolitan",
        "connectional",
        "cackswitut",
        "report",
        "july 20",
        "2019"
      ],
      "match_type": "content",
      "relationships": {
        "previous": [],
        "next": []
      }
    },
    {
      "file_id": "EFTA00034163",
      "summary": "This is a Lieutenant’s log and daily activities report for Saturday, July 20, 2019, from the Metropolitan Correctional Center in New York (150 Via Rut, New York, NY 10007). The document is classified as CONFIDENTIAL and includes the case numbers SDNY_00010381 and EFTA00034163.",
      "timestamp": "2019-07-20T00:00:00",
      "timestamp_raw": "July 20, 2019",
      "keywords": [
        "efta00034163",
        "lieutenant",
        "confidential",
        "sdny_00010381",
        "afettopotitan connectional center",
        "july 20",
        "2019",
        "report",
        "daily activities",
        "redaction analysis"
      ],
      "match_type": "content",
      "relationships": {
        "previous": [],
        "next": []
      }
    },
    {
      "file_id": "EFTA00034547",
      "summary": "On July 21, 2019, a Lieutenant documented their activities and provided a daily report, including a log, within the context of the “Yuan” and “Atetwpolitan &vocational Centex” locations. The report was classified as CONFIDENTIAL and referenced case numbers SDNY_000 11342 and EFTA00034547.",
      "timestamp": "2019-07-21T00:00:00",
      "timestamp_raw": "July 21, 2019",
      "keywords": [
        "lieutenant",
        "daily activities report",
        "efta00034547",
        "redaction analysis",
        "yuan",
        "confidential",
        "2019",
        "2025-12-27"
      ],
      "match_type": "keyword",
      "relationships": {
        "previous": [],
        "next": []
      }
    },
    {
      "file_id": "EFTA00034907",
      "summary": "This document is a Lieutenant’s log and daily activities report for Sunday, July 21, 2019, including associated files: TEXT.htm, LIEUTENANT’S LOG 07-21-2019.docm, and Daily Activities Report 7-21-2019.docx. It identifies a location as “15C Auk .R.04O” and references “EFTA00034907” and “SDNY_000 12839.”",
      "timestamp": "2019-07-21T00:00:00",
      "timestamp_raw": "July 21, 2019",
      "keywords": [
        "lieutenant",
        "log",
        "daily activities report",
        "2019",
        "july 21",
        "redaction",
        "efta00034907",
        "confidential",
        "sdny_000 12839",
        "1.11piikatutt"
      ],
      "match_type": "keyword",
      "relationships": {
        "previous": [],
        "next": []
      }
    },
    {
      "file_id": "EFTA00034162",
      "summary": "This is a Lieutenant’s log and daily activities report for Sunday, July 21, 2019. The report details activities at 150 9th Avenue, New York, NY 10007, including the “Batter:ant” and “5edacti Swteau 4 Abets°” and identifies the case as “Mettepalitan Covactiestal Centel” with case numbers SDNY_000 10366 and EFTA00034162. The report is classified as CONFIDENTIAL.",
      "timestamp": "2019-07-21T00:00:00",
      "timestamp_raw": "July 21, 2019",
      "keywords": [
        "efta00034162",
        "lieutenant's log",
        "daily activities report",
        "sunday",
        "july 21",
        "2019",
        "confidential",
        "sdny_00010366",
        "batter",
        "mettepalitan covactiestal centel",
        "150 9'aitk rout"
      ],
      "match_type": "keyword",
      "relationships": {
        "previous": [],
        "next": []
      }
    },
    {
      "file_id": "EFTA00033586",
      "summary": "This is a Lieutenant’s log and daily activities report for Sunday, July 21, 2019, detailing activities at the Saimaa 4 ‘doom’, Baiter:ant, Educational Saimaa 4 ‘doom’, Metropolitan & Emotional Centex, and referencing case numbers N410007 and SDNY_00008767. The document is classified as CONFIDENTIAL.",
      "timestamp": "2019-07-21T00:00:00",
      "timestamp_raw": "July 21, 2019",
      "keywords": [
        "efta00033586",
        "saimaa",
        "lieutenant's log",
        "sunday",
        "july 21",
        "2019",
        "confidential",
        "sdny_00008767",
        "baiter",
        "centex",
        "5edual"
      ],
      "match_type": "content",
      "relationships": {
        "previous": [],
        "next": []
      }
    },
    {
      "file_id": "EFTA00034695",
      "summary": "A daily activities report and lieutenant’s log were created on July 22, 2019, under the file designation EFTA00034695. The documents are marked as confidential and associated with SDNY_000 12070.",
      "timestamp": "2019-07-22T00:00:00",
      "timestamp_raw": "July 22, 2019",
      "keywords": [
        "efta00034695",
        "daily activities report",
        "lieutenant's log",
        "2019",
        "confidential",
        "sdny_000",
        "redaction analysis"
      ],
      "match_type": "keyword",
      "relationships": {
        "previous": [
          {
            "file_id": "EFTA00034687",
            "similarity": 0.556,
            "index": 21,
            "category": "relevant"
          },
          {
            "file_id": "EFTA00034161",
            "similarity": 0.556,
            "index": 20,
            "category": "relevant"
          },
          {
            "file_id": "EFTA00034884",
            "similarity": 0.556,
            "index": 11,
            "category": "relevant"
          }
        ],
        "next": [
          {
            "file_id": "EFTA00034920",
            "similarity": 0.75,
            "index": 31,
            "category": "highly_relevant"
          },
          {
            "file_id": "EFTA00034943",
            "similarity": 0.556,
            "index": 38,
            "category": "relevant"
          },
          {
            "file_id": "EFTA00034974",
            "similarity": 0.556,
            "index": 44,
            "category": "relevant"
          }
        ]
      }
    },
    {
      "file_id": "EFTA00034920",
      "summary": "A daily activities report and lieutenant’s log, dated July 22, 2019, were generated under the file designation EFTA00034920. The documents are classified as CONFIDENTIAL and associated with case number SDNY_000 12866. The report originates from [REDACTED].",
      "timestamp": "2019-07-22T00:00:00",
      "timestamp_raw": "July 22, 2019",
      "keywords": [
        "efta00034920",
        "daily activities report",
        "lieutenant's log",
        "2019",
        "confidential",
        "sdny_000",
        "redaction analysis"
      ],
      "match_type": "keyword",
      "relationships": {
        "previous": [
          {
            "file_id": "EFTA00034695",
            "similarity": 0.75,
            "index": 30,
            "category": "highly_relevant"
          },
          {
            "file_id": "EFTA00034687",
            "similarity": 0.556,
            "index": 21,
            "category": "relevant"
          },
          {
            "file_id": "EFTA00034161",
            "similarity": 0.556,
            "index": 20,
            "category": "relevant"
          }
        ],
        "next": [
          {
            "file_id": "EFTA00034943",
            "similarity": 0.556,
            "index": 38,
            "category": "relevant"
          },
          {
            "file_id": "EFTA00034974",
            "similarity": 0.556,
            "index": 44,
            "category": "relevant"
          },
          {
            "file_id": "EFTA00033686",
            "similarity": 0.556,
            "index": 49,
            "category": "relevant"
          }
        ]
      }
    },
    {
      "file_id": "EFTA00033637",
      "summary": "This document is a Confidential Daily Activities Report and Lieutenant’s Log from July 22, 2019, related to case EFTA00033637, SDNY_00008982. It includes two files: Daily Activities Report 7-22-2019.docx and LIEUTENANTS LOG 07-22-2019.docm.",
      "timestamp": "2019-07-22T00:00:00",
      "timestamp_raw": "July 22, 2019",
      "keywords": [
        "efta00033637",
        "daily activities report",
        "lieutenant's log",
        "7-22-2019",
        "confidential",
        "sdny_00008982",
        "redaction analysis"
      ],
      "match_type": "keyword",
      "relationships": {
        "previous": [],
        "next": []
      }
    },
    {
      "file_id": "EFTA00034622",
      "summary": "This document is a “Daily Activities Report/Lieutenant’s Log” dated July 23, 2019, from the Chief Psychologist of the U.S. Department of Justice/Federal Bureau of Prisons at the Metropolitan Correctional Center in New York. The report is addressed to and from redacted individuals and includes the identification number SDNY_00011747 and inmate file EFTA00034622. It is marked as CONFIDENTIAL.",
      "timestamp": "2019-07-23T00:00:00",
      "timestamp_raw": "July 23, 2019",
      "keywords": [
        "efta00034622",
        "redaction analysis",
        "daily activities report",
        "lieutenant's log",
        "chief psychologist",
        "u.s. department of justice",
        "federal bureau of prisons",
        "metropolitan correctional center",
        "sdny_00011747",
        "2019"
      ],
      "match_type": "keyword",
      "relationships": {
        "previous": [],
        "next": []
      }
    },
    {
      "file_id": "EFTA00034717",
      "summary": "On July 24, 2019, a Daily Activities Report and Lieutenant’s Log were created and submitted under the case file EFTA00034717. The documents were marked as CONFIDENTIAL and associated with SDNY_00012139. A redaction was identified on page 1.",
      "timestamp": "2019-07-24T00:00:00",
      "timestamp_raw": "July 24, 2019",
      "keywords": [
        "efta00034717",
        "daily activities report",
        "lieutenant's log",
        "7-24-2019",
        "confidential",
        "sdny_00012139",
        "redaction analysis"
      ],
      "match_type": "keyword",
      "relationships": {
        "previous": [],
        "next": [
          {
            "file_id": "EFTA00033591",
            "similarity": 0.556,
            "index": 36,
            "category": "relevant"
          }
        ]
      }
    },
    {
      "file_id": "EFTA00035275",
      "summary": "On July 24, 2019, a daily activities report and lieutenant’s log were generated, attached to an email sent from [REDACTED] to [REDACTED] with the subject “Daily Activities Report/Lieutenants Log.” The reports and logs are identified as EFTA00035275.",
      "timestamp": "2019-07-24T00:00:00",
      "timestamp_raw": "July 24, 2019",
      "keywords": [
        "efta00035275",
        "daily activities report",
        "lieutenants log",
        "7-24-2019",
        "redaction",
        "report",
        "log",
        "document",
        "attachments"
      ],
      "match_type": "keyword",
      "relationships": {
        "previous": [],
        "next": []
      }
    },
    {
      "file_id": "EFTA00033591",
      "summary": "This document contains a Daily Activities Report and Lieutenant’s Log from July 24, 2019, associated with the case file EFTA00033591 and the SDNY_00008783 reference. The report is marked as confidential.",
      "timestamp": "2019-07-24T00:00:00",
      "timestamp_raw": "July 24, 2019",
      "keywords": [
        "efta00033591",
        "daily activities report",
        "lieutenant's log",
        "7-24-2019",
        "confidential",
        "sdny_00008783",
        "redaction analysis"
      ],
      "match_type": "keyword",
      "relationships": {
        "previous": [
          {
            "file_id": "EFTA00034717",
            "similarity": 0.556,
            "index": 34,
            "category": "relevant"
          }
        ],
        "next": []
      }
    },
    {
      "file_id": "EFTA00035274",
      "summary": "This document is a Daily Activities Report/Lieutenants Log from July 25, 2019, generated by the Chief Psychologist of the U.S. Department of Justice/Federal Bureau of Prisons, Metropolitan Correctional Center in New York. The report pertains to inmate EFTA00035274 and includes attachments named TEXT.htm and an unnamed embedded file.",
      "timestamp": "2019-07-25T00:00:00",
      "timestamp_raw": "July 25, 2019",
      "keywords": [
        "efta00035274",
        "daily activities report",
        "lieutenants log",
        "u.s. department of justice",
        "federal bureau of prisons",
        "metropolitan correctional center",
        "chief psychologist",
        "7-24-2019",
        "text.htm"
      ],
      "match_type": "keyword",
      "relationships": {
        "previous": [],
        "next": []
      }
    },
    {
      "file_id": "EFTA00034943",
      "summary": "A daily activities report and lieutenant’s log were generated on July 26, 2019, under the designation SDNY_000 12934 and EFTA00034943. The documents were marked as confidential and sent from [REDACTED].",
      "timestamp": "2019-07-26T00:00:00",
      "timestamp_raw": "July 26, 2019",
      "keywords": [
        "efta00034943",
        "daily activities report",
        "lieutenant's log",
        "7-26-2019",
        "confidential",
        "sdny_000",
        "redaction analysis"
      ],
      "match_type": "keyword",
      "relationships": {
        "previous": [
          {
            "file_id": "EFTA00034920",
            "similarity": 0.556,
            "index": 31,
            "category": "relevant"
          },
          {
            "file_id": "EFTA00034695",
            "similarity": 0.556,
            "index": 30,
            "category": "relevant"
          },
          {
            "file_id": "EFTA00034161",
            "similarity": 0.556,
            "index": 20,
            "category": "relevant"
          }
        ],
        "next": [
          {
            "file_id": "EFTA00034974",
            "similarity": 0.556,
            "index": 44,
            "category": "relevant"
          }
        ]
      }
    },
    {
      "file_id": "EFTA00034748",
      "summary": "This document is a Lieutenant’s log and Daily activity report for Sunday, July 28, 2019, originating from the “Redacted” source. It includes documents titled “Lieutenant’s log 07-27-2019.docm,” “Daily Activities Report 7-28-2019.docx,” and “Lieutenant’s log and Daily activity report for Sunday, July 28, 2019.” The report references the “State of Allen,” “Connection Center,” and the address 15C ‘can .Rout, New ‘Yak, .V.V. 10007.” It is marked as CONFIDENTIAL and includes case identifiers SDNY_00012205 and EFTA00034748.",
      "timestamp": "2019-07-28T00:00:00",
      "timestamp_raw": "July 28, 2019",
      "keywords": [
        "lieutenant",
        "log",
        "daily activity report",
        "july 28",
        "2019",
        "confidential",
        "efta00034748",
        "redaction analysis"
      ],
      "match_type": "content",
      "relationships": {
        "previous": [],
        "next": []
      }
    },
    {
      "file_id": "EFTA00033600",
      "summary": "This document is a Confidential Daily Activities Report and Lieutenant’s Log for July 29, 2019, pertaining to case EFTA00033600, SDNY_00008805. It includes two files: “Daily Activities Report 7-29-2019.docx” and “LIEUTENANTS LOG 07-29-2019.docm.”",
      "timestamp": "2019-07-29T00:00:00",
      "timestamp_raw": "July 29, 2019",
      "keywords": [
        "efta00033600",
        "daily activities report",
        "lieutenants log",
        "7-29-2019",
        "confidential",
        "sdny_00008805"
      ],
      "match_type": "keyword",
      "relationships": {
        "previous": [],
        "next": []
      }
    },
    {
      "file_id": "EFTA00034963",
      "summary": "This document is a Daily Activities Report and Lieutenant’s Log from July 29, 2019, pertaining to case EFTA00034963. It includes two documents: “Daily Activities Report 7-29-2019.docx” and “LIEUTENANTS LOG 07-29-2019.docm,” flagged as confidential and associated with SDNY_00012974.",
      "timestamp": "2019-07-29T00:00:00",
      "timestamp_raw": "July 29, 2019",
      "keywords": [
        "efta00034963",
        "daily activities report",
        "lieutenants log",
        "2019",
        "7-29",
        "confidential",
        "sdny_00012974",
        "redaction analysis"
      ],
      "match_type": "keyword",
      "relationships": {
        "previous": [],
        "next": []
      }
    },
    {
      "file_id": "EFTA00035283",
      "summary": "A daily activities report and lieutenant’s log were generated on July 30, 2019, at 08:03:01 +0000. The report was sent from “[REDACTED]” to “[REDACTED]” and includes the attachments: Daily_Activities_Report_7-29-2019.docx and LIEUTENANTS_LOG_07-29-2019.docm. The email subject is “Daily Activities Report/Lieutenants Log....7-29-2019”.",
      "timestamp": "2019-07-30T00:00:00",
      "timestamp_raw": "July 30, 2019",
      "keywords": [
        "efta00035283",
        "daily activities report",
        "lieutenants log",
        "2019",
        "7-29",
        "2025-12-27",
        "redaction analysis",
        "document",
        "report",
        "log"
      ],
      "match_type": "keyword",
      "relationships": {
        "previous": [],
        "next": []
      }
    },
    {
      "file_id": "EFTA00033652",
      "summary": "This document is a daily activities report and lieutenant’s log from July 31, 2019, generated on August 1, 2019, at 9:30:35 AM. It includes the documents “Daily Activities Report 7-31-2019.docx” and “LIEUTENANTS LOG 07-31-2019.docm” and is classified as CONFIDENTIAL with case numbers SDNY_00009036 and EFTA00033652.",
      "timestamp": "2019-07-31T00:00:00",
      "timestamp_raw": "July 31, 2019",
      "keywords": [
        "efta00033652",
        "daily activities report",
        "lieutenant's log",
        "7-31-2019",
        "confidential",
        "sdny_00009036"
      ],
      "match_type": "keyword",
      "relationships": {
        "previous": [],
        "next": []
      }
    },
    {
      "file_id": "EFTA00034974",
      "summary": "A daily activities report and lieutenant’s log were generated on July 31, 2019, under the case number EFTA00034974. The documents are marked as confidential and associated with SDNY_000 13001.",
      "timestamp": "2019-07-31T00:00:00",
      "timestamp_raw": "July 31, 2019",
      "keywords": [
        "efta00034974",
        "daily activities report",
        "lieutenant's log",
        "7-31-2019",
        "confidential",
        "sdny_000",
        "redaction analysis"
      ],
      "match_type": "keyword",
      "relationships": {
        "previous": [
          {
            "file_id": "EFTA00034943",
            "similarity": 0.556,
            "index": 38,
            "category": "relevant"
          },
          {
            "file_id": "EFTA00034920",
            "similarity": 0.556,
            "index": 31,
            "category": "relevant"
          },
          {
            "file_id": "EFTA00034695",
            "similarity": 0.556,
            "index": 30,
            "category": "relevant"
          }
        ],
        "next": []
      }
    },
    {
      "file_id": "EFTA00034787",
      "summary": "A lieutenant’s log and daily activity report for Saturday, August 3, 2019, was generated. The report includes documents titled “Daily Activities Report 8-03-2019.docx,” “LIEUTENANT’S LOG 08-03-2019.docm,” and “Lieutenant’s ud daily activity report for Saturday, August 3, 2019.” The report is classified as CONFIDENTIAL and includes identifiers SDNY_00012391 and EFTA00034787.",
      "timestamp": "2019-08-03T00:00:00",
      "timestamp_raw": "August 3, 2019",
      "keywords": [
        "efta00034787",
        "redaction analysis",
        "lieutenant's log",
        "daily activity report",
        "august 3",
        "2019",
        "confidential",
        "sdny_00012391",
        "pain",
        "aid"
      ],
      "match_type": "content",
      "relationships": {
        "previous": [],
        "next": []
      }
    },
    {
      "file_id": "EFTA00033633",
      "summary": "On August 4, 2019, a lieutenant documented their activities via a log, daily activity report, and associated documents including “Lieutenant’s Ion and daily activity log for Sunday, August 4, 2019.txt,” and “Daily Activities Report 8-04.2019.docx.” The report originates from the Afettopotitan Connectional Center located at 150 Am* Now, Sew lkuf, S.2j. 10007 and is classified as CONFIDENTIAL, referencing case numbers SDNY_00008935 and EFTA00033633.",
      "timestamp": "2019-08-04T00:00:00",
      "timestamp_raw": "August 4, 2019",
      "keywords": [
        "lieutenant",
        "log",
        "daily activity",
        "august 4",
        "2019",
        "confidential",
        "efta00033633"
      ],
      "match_type": "content",
      "relationships": {
        "previous": [],
        "next": []
      }
    },
    {
      "file_id": "EFTA00033706",
      "summary": "This document is a Daily Activities Report and Lieutenant’s Log from August 5, 2019, generated on August 6, 2019. It includes two redactions and is labeled as CONFIDENTIAL with identifiers SDNY_00009160 and EFTA00033706.  The report was sent from one individual to another.",
      "timestamp": "2019-08-05T00:00:00",
      "timestamp_raw": "August 5, 2019",
      "keywords": [
        "efta00033706",
        "daily activities report",
        "lieutenant's log",
        "8-05-2019",
        "redaction",
        "confidential",
        "sdny_00009160"
      ],
      "match_type": "keyword",
      "relationships": {
        "previous": [],
        "next": []
      }
    },
    {
      "file_id": "EFTA00035004",
      "summary": "This document is a confidential Daily Activities Report and Lieutenant’s Log from August 7, 2019, associated with case EFTA00035004. It includes two files: “Daily Activities Report 8-07-2019.docx” and “LIEUTENANTS LOG 08-07-2019.docm”.",
      "timestamp": "2019-08-07T00:00:00",
      "timestamp_raw": "August 7, 2019",
      "keywords": [
        "efta00035004",
        "daily activities report",
        "lieutenant's log",
        "redaction",
        "sdny_000",
        "2019",
        "2025",
        "confidential",
        "docm",
        "doc"
      ],
      "match_type": "keyword",
      "relationships": {
        "previous": [],
        "next": [
          {
            "file_id": "EFTA00035020",
            "similarity": 0.545,
            "index": 54,
            "category": "relevant"
          }
        ]
      }
    },
    {
      "file_id": "EFTA00033686",
      "summary": "A daily activities report and lieutenant’s log were created on August 7, 2019, under the subject “Daily Activities Report/Lieutenant’s Log.” The documents are labeled as confidential and associated with case numbers SDNY_00009111 and EFTA00033686.",
      "timestamp": "2019-08-07T00:00:00",
      "timestamp_raw": "August 7, 2019",
      "keywords": [
        "efta00033686",
        "daily activities report",
        "lieutenant's log",
        "confidential",
        "sdny_00009111",
        "2019",
        "redaction analysis"
      ],
      "match_type": "keyword",
      "relationships": {
        "previous": [
          {
            "file_id": "EFTA00034920",
            "similarity": 0.556,
            "index": 31,
            "category": "relevant"
          },
          {
            "file_id": "EFTA00034695",
            "similarity": 0.556,
            "index": 30,
            "category": "relevant"
          },
          {
            "file_id": "EFTA00034687",
            "similarity": 0.556,
            "index": 21,
            "category": "relevant"
          }
        ],
        "next": []
      }
    },
    {
      "file_id": "EFTA00034096",
      "summary": "The document is a Confidential Daily Activities Report and Lieutenant’s Log from August 8, 2019 (8-08-2019), associated with case EFTA00034096 and SDNY_00010137. It includes two documents: Daily Activities Report 8-08-2019.docx and LIEUTENANTS LOG 08-08-2019.docm.",
      "timestamp": "2019-08-08T00:00:00",
      "timestamp_raw": "August 8, 2019",
      "keywords": [
        "efta00034096",
        "redaction analysis",
        "daily activities report",
        "lieutenants log",
        "sdny_00010137",
        "8-08-2019"
      ],
      "match_type": "keyword",
      "relationships": {
        "previous": [],
        "next": []
      }
    },
    {
      "file_id": "EFTA00034097",
      "summary": "This document is a Confidential Daily Activities Report and Lieutenant’s Log dated August 9, 2019, pertaining to EFTA00034097. The report includes two files: Daily Activities Report 8-09-2019.docx and LIEUTENANTS LOG 08-09-2019.docm.  The document is associated with the case SDNY_00010147.",
      "timestamp": "2019-08-09T00:00:00",
      "timestamp_raw": "August 9, 2019",
      "keywords": [
        "efta00034097",
        "daily activities report",
        "lieutenants log",
        "8-09-2019",
        "confidential",
        "sdny_00010147",
        "redaction analysis"
      ],
      "match_type": "keyword",
      "relationships": {
        "previous": [],
        "next": []
      }
    },
    {
      "file_id": "EFTA00034066",
      "summary": "This document is a redacted daily activity log and Lieutenant’s log for Saturday, August 10, 2019, pertaining to EFTA00034066. The log includes a daily activities report, a Lieutenant’s log, and references to Aiietto, Metropolitan Coxtettiostal Centex, and associated confidential information including case numbers SDNY_00010046.",
      "timestamp": "2019-08-10T00:00:00",
      "timestamp_raw": "August 10, 2019",
      "keywords": [
        "efta00034066",
        "lieutenant's log",
        "daily activities report",
        "2019",
        "redaction analysis",
        "confidential",
        "sdny_00010046",
        "aiietto",
        "georgetown",
        "coxtettiostal centex"
      ],
      "match_type": "keyword",
      "relationships": {
        "previous": [],
        "next": []
      }
    },
    {
      "file_id": "EFTA00033614",
      "summary": "This document is a Lieutenant’s log and daily activity report for Saturday, August 10, 2019, including associated documents (TEXT.htm, Daily Activities Report 8-10-2019.docx, LIEUTENANT’S LOG 08-10-2019.docm). It references locations and organizations including Deutesuud, gedetal 33ateau of 3`'yboni, Metopetitan emotectional Centex, 150 .`Path gala, and SDNY_00008862, along with the EFTA00033614 file. The document is classified as CONFIDENTIAL.",
      "timestamp": "2019-08-10T00:00:00",
      "timestamp_raw": "August 10, 2019",
      "keywords": [
        "lieutenant",
        "log",
        "daily activity",
        "august 10",
        "2019",
        "redaction",
        "confidential",
        "sdny_00008862",
        "efta00033614"
      ],
      "match_type": "content",
      "relationships": {
        "previous": [
          {
            "file_id": "EFTA00033576",
            "similarity": 0.5,
            "index": 15,
            "category": "relevant"
          }
        ],
        "next": []
      }
    },
    {
      "file_id": "EFTA00035020",
      "summary": "This document is a Daily Activities Report-Lieutenants Log from August 11, 2019, generated on August 5, 2019. It is a confidential report associated with case number SDNY_000 13139 and file EFTA00035020.  It includes three documents: Daily Activities Report-Lieutenants Log 08-11-2019, Daily Activities Report-Lieutenants Log 05-04-2019, and LIEUTENANT'S LOG 08-11-2019.",
      "timestamp": "2019-08-11T00:00:00",
      "timestamp_raw": "August 11, 2019",
      "keywords": [
        "efta00035020",
        "daily activities report",
        "lieutenant's log",
        "sdny_000",
        "2019",
        "2025",
        "confidential"
      ],
      "match_type": "keyword",
      "relationships": {
        "previous": [
          {
            "file_id": "EFTA00035004",
            "similarity": 0.545,
            "index": 48,
            "category": "relevant"
          },
          {
            "file_id": "EFTA00034920",
            "similarity": 0.556,
            "index": 31,
            "category": "relevant"
          },
          {
            "file_id": "EFTA00034695",
            "similarity": 0.556,
            "index": 30,
            "category": "relevant"
          }
        ],
        "next": []
      }
    },
    {
      "file_id": "EFTA00033616",
      "summary": "This document is a confidential Daily Activities Report-Lieutenants Log, dated August 11, 2019, generated on August 5, 2019 (LOC). It includes associated documents: Daily Activities Report-Lieutenants LOC (05-04-2019.docx) and LIEUTENANT’S LOG 08-11-2019.docm. The report is associated with case number SDNY_00008873 and EFTA00033616.  The report was sent to various personnel including NYM Duty Officers, Executive Staff, Lieutenants, and Psychology Services within the Bureau of Prisons.",
      "timestamp": "2019-08-11T00:00:00",
      "timestamp_raw": "August 11, 2019",
      "keywords": [
        "efta00033616",
        "redaction analysis",
        "lieutenant's log",
        "daily activities report",
        "nym",
        "bop",
        "2019",
        "2025",
        "confidential",
        "loc"
      ],
      "match_type": "keyword",
      "relationships": {
        "previous": [],
        "next": []
      }
    },
    {
      "file_id": "EFTA00034564",
      "summary": "This document is a confidential Daily Activities Report-Lieutenants Log dated August 11, 2019, generated from three files: Daily Activities Report-Lieutenants Log 08-11-2019, Daily Activities Report-Lieutenants Log 05-04-2019, and LIEUTENANT'S LOG 08-11-2019.DOCM. The report is associated with case number SDNY_00011485 and file EFTA00034564. It was sent from [REDACTED] on August 8, 2019.",
      "timestamp": "2019-08-11T00:00:00",
      "timestamp_raw": "August 11, 2019",
      "keywords": [
        "efta00034564",
        "daily activities report",
        "lieutenant's log",
        "confidential",
        "sdny_00011485",
        "2019",
        "2025",
        "redaction",
        "report",
        "log"
      ],
      "match_type": "keyword",
      "relationships": {
        "previous": [
          {
            "file_id": "EFTA00034129",
            "similarity": 0.538,
            "index": 7,
            "category": "relevant"
          }
        ],
        "next": []
      }
    },
    {
      "file_id": "EFTA00033681",
      "summary": "A daily activities report and lieutenant’s log were created on August 14, 2019, and are designated as CONFIDENTIAL. The documents relate to SDNY_00009101 and EFTA00033681.",
      "timestamp": "2019-08-14T00:00:00",
      "timestamp_raw": "August 14, 2019",
      "keywords": [
        "efta00033681",
        "redaction analysis",
        "daily activities report",
        "lieutenants log",
        "sdny_00009101",
        "2019",
        "8-14-2019"
      ],
      "match_type": "keyword",
      "relationships": {
        "previous": [],
        "next": []
      }
    },
    {
      "file_id": "EFTA00035060",
      "summary": "On August 15, 2019, a Daily Activities Report and a Lieutenant’s Log were generated and attached to email EFTA00035060. The Daily Activities Report is documented in the file Daily_Activities_Report_8-15-2019.docx and the Lieutenant’s Log is documented in the file LIEUTENANTS_LOG_08-15-2019.docm.",
      "timestamp": "2019-08-15T00:00:00",
      "timestamp_raw": "August 15, 2019",
      "keywords": [
        "daily activities report",
        "lieutenants log",
        "2019",
        "efta00035060",
        "report",
        "log"
      ],
      "match_type": "keyword",
      "relationships": {
        "previous": [
          {
            "file_id": "EFTA00035559",
            "similarity": 0.5,
            "index": 12,
            "category": "relevant"
          }
        ],
        "next": []
      }
    },
    {
      "file_id": "EFTA00033670",
      "summary": "This document contains a Daily Activities Report and Lieutenant’s Log for August 15, 2019, related to case EFTA00033670, SDNY_00009088. The report is marked as Confidential.",
      "timestamp": "2019-08-15T00:00:00",
      "timestamp_raw": "August 15, 2019",
      "keywords": [
        "efta00033670",
        "daily activities report",
        "lieutenant's log",
        "8-15-2019",
        "confidential",
        "sdny_00009088"
      ],
      "match_type": "keyword",
      "relationships": {
        "previous": [],
        "next": [
          {
            "file_id": "EFTA00033621",
            "similarity": 0.5,
            "index": 60,
            "category": "relevant"
          }
        ]
      }
    },
    {
      "file_id": "EFTA00033621",
      "summary": "This document is a Daily Activities Report and Lieutenant’s Log for August 15, 2019, pertaining to case EFTA00033621. It is marked as CONFIDENTIAL and associated with SDNY_00008901. A redaction exists within the document.",
      "timestamp": "2019-08-15T00:00:00",
      "timestamp_raw": "August 15, 2019",
      "keywords": [
        "efta00033621",
        "daily activities report",
        "lieutenant's log",
        "8-15-2019",
        "confidential",
        "sdny_00008901"
      ],
      "match_type": "keyword",
      "relationships": {
        "previous": [
          {
            "file_id": "EFTA00033670",
            "similarity": 0.5,
            "index": 59,
            "category": "relevant"
          }
        ],
        "next": []
      }
    },
    {
      "file_id": "EFTA00035009",
      "summary": "This document is a redaction analysis of a file (EFTA00035009.pdf) generated on December 27, 2025. It includes a Daily Activities Report and Lieutenant's Log for August 9, 2019, related to case number SDNY_00013098, with the sender redacted.",
      "timestamp": null,
      "timestamp_raw": null,
      "keywords": [
        "efta00035009",
        "daily activities report",
        "lieutenant's log",
        "8-09-2019",
        "confidential",
        "sdny_00013098"
      ],
      "match_type": "keyword",
      "relationships": {
        "previous": [],
        "next": []
      }
    },
    {
      "file_id": "EFTA00034601",
      "summary": "This document is a redaction analysis related to EFTA00034601.pdf, generated on December 27, 2025. It includes a Lieutenant’s log and daily activity report for Saturday, August 3, 2019, designated as CONFIDENTIAL and associated with case numbers SDNY_00011635 and EFTA00034601.  The report contains multiple associated files: TEXT.htm, Daily Activities Report 8-03-2019.docx, and LIEUTENANT’S LOG 08-03-2019.docm.",
      "timestamp": null,
      "timestamp_raw": null,
      "keywords": [
        "efta00034601",
        "redaction analysis",
        "lieutenant's log",
        "daily activity report",
        "august 3",
        "2019",
        "confidential",
        "sdny_00011635",
        "cadet",
        "nieto"
      ],
      "match_type": "content",
      "relationships": {
        "previous": [],
        "next": []
      }
    }
  ]
}